"Refid","Author","Title","Abstract","Accession Number","Art. no.","Article Number","Author Address","Author keywords","Author(s) id","Cited by","Comments","Custom 4","Custom 5","Database","Database Provider","Date","distiller_reference_created_date","distiller_reference_upload_date","Document type","DOI","Eid","Epub Date","File attachment","Index keywords","ISSN","Issue","Journal","Keywords","Label","Language","Legal Note","Level","Link","min_level","NIHMSID","Notes","Number","Open access","Original Publication","Page count","Page end","Page start","Pages","Place Published","PMCID","Publication stage","Publisher","Pubmed id","Rapidscreening","Research Notes","Secondary Author","Section","Short Title","Source","Source title","Translated Title","Type","Type of Work","URL","User","Volume","Year"
128,"Abenayake, C. C., Mikami, Y., Matsuda, Y.","Ecosystem services-based composite indicator for assessing community resilience to floods","… the pollution levels of water bodies. Therefore, assessing the community resilience requires … The ESs-based conceptual framework that was developed in this study emphasizes the role …",,,,,,,,,,,"GS Search 1",,//,"2024-10-03 23:12:33","2024-10-03 23:12:33",,,,,,,,,"Environmental …",,,,,,,,,"Cited By (since 2018): 43",,,,,,,,,,,,,,,,,"Ecosystem services-based composite indicator for assessing community resilience to floods",,,,JOUR,,"https://www.sciencedirect.com/science/article/pii/S2211464517301057 https://www.researchgate.net/profile/Amila-Jayasinghe/publication/327034449_Ecosystem_services-based_composite_indicator_for_assessing_community_resilience_to_floods/links/5c3d2144299bf12be3c89941/Ecosystem-services-based-composite-indicator-for-assessing-community-resilience-to-floods.pdf",,,2018
129,"Ahmadi, Z., Ghasemi, M.","Integrating flood and earthquake resilience: a framework for assessing urban community resilience against multiple hazards","… earthquake off the Pacific coast of Japan not only caused a tsunami but also led to a nuclear meltdown at a power plant, resulting in a hazardous radiation leak that contaminated the …",,,,,,,,,,,"GS Search 1",,//,"2024-10-03 23:12:33","2024-10-03 23:12:33",,,,,,,,,"Journal of Safety …",,,,,,,,,"Cited By (since 2024): 1",,,,,,,,,,,,,,,,,"Integrating flood and earthquake resilience: a framework for assessing urban community resilience against multiple hazards",,,,JOUR,,https://www.sciencedirect.com/science/article/pii/S2666449624000392,,,2024
130,"Almutairi, Arif, Mourshed, Monjur, Ameen, Raed Fawzi Mohammed","Coastal community resilience frameworks for disaster risk management","… community resilience assessment frameworks, a broad-based search strategy was implemented to develop knowledge regarding current assessment frameworks and … pollution control. …",,,,,,,,,,,"GS Search 1",,//,"2024-10-03 23:12:33","2024-10-03 23:12:33",,10.1007/s11069-020-03875-3,,,,,"0921-030X 1573-0840",2,"Natural Hazards",,,,,,,,,"Cited By (since 2020): 87",,,,,,,595-630,,,,,,,,,595,"Coastal community resilience frameworks for disaster risk management",,,,JOUR,,https://link.springer.com/article/10.1007/s11069-020-03875-3,,101,2020
131,"Alshehri, Saud Ali, Rezgui, Yacine, Li, Haijiang","Delphi-based consensus study into a framework of community resilience to disaster","… as transportation systems, electric power and telephone; brown field treatment (contaminated land with low levels of hazardous waste and pollutants); and immunisation programmes. …",,,,,,,,,,,"GS Search 1",,//,"2024-10-03 23:12:33","2024-10-03 23:12:33",,10.1007/s11069-014-1423-x,,,,,"0921-030X 1573-0840",3,"Natural Hazards",,,,,,,,,"Cited By (since 2015): 135",,,,,,,2221-2245,,,,,,,,,2221,"Delphi-based consensus study into a framework of community resilience to disaster",,,,JOUR,,https://link.springer.com/article/10.1007/s11069-014-1423-x,,75,2014
132,"Amin Enderami, S., Mazumder, Ram K., Dumler, Meredith, Sutley, Elaina J.","Virtual Testbeds for Community Resilience Analysis: State-of-the-Art Review, Consensus Study, and Recommendations","… The testbed is used for evaluating existing resilience assessment frameworks for Chinese cities. … “An agent-based modeling approach for simulating contamination events applied to the …",,,,,,,,,,,"GS Search 1",,//,"2024-10-03 23:12:33","2024-10-03 23:12:33",,10.1061/(asce)nh.1527-6996.0000582,,,,,"1527-6988 1527-6996",4,"Natural Hazards Review",,,,,,,,,"Cited By (since 2022): 12",,,,,,,,,,,,,,,,,"Virtual Testbeds for Community Resilience Analysis: State-of-the-Art Review, Consensus Study, and Recommendations",,,,JOUR,,"https://ascelibrary.org/doi/abs/10.1061/(ASCE)NH.1527-6996.0000582 https://par.nsf.gov/servlets/purl/10394596",,23,2022
133,"Archer, Diane, Marome, Wijitbusaba, Natakun, Boonanan, Mabangyang, Pattaradeth, Phanthuwongpakdee, Nuttavikhom","The role of collective and individual assets in building urban community resilience","… additional health hazards coming from the polluted waterways. … environmental hazards, including air and water pollution. … Based on these, we develop an asset adaptation framework, …",,,,,,,,,,,"GS Search 1",,//,"2024-10-03 23:12:33","2024-10-03 23:12:33",,10.1080/19463138.2019.1671425,,,,,"1946-3138 1946-3146",2,"International Journal of Urban Sustainable Development",,,,,,,,,"Cited By (since 2020): 26",,,,,,,169-186,,,,,,,,,169,"The role of collective and individual assets in building urban community resilience",,,,JOUR,,"https://www.tandfonline.com/doi/abs/10.1080/19463138.2019.1671425 https://www.tandfonline.com/doi/pdf/10.1080/19463138.2019.1671425",,12,2019
134,"Atreya, A., Kunreuther, H.","Measuring community resilience: the role of the community rating system (CRS)","… community resilience, in this paper, we focus on the flood hazard, but the framework can be … The stormwater BMP prevents stormwater pollution, improving the quality of natural capital …",,,,,,,,,,,"GS Search 1",,//,"2024-10-03 23:12:33","2024-10-03 23:12:33",,,,,,,,,"Available at SSRN 2788230",,,,,,,,,"Cited By (since 2016): 28",,,,,,,,,,,,,,,,,"Measuring community resilience: the role of the community rating system (CRS)",,,,JOUR,,https://papers.ssrn.com/sol3/papers.cfm?abstract_id=2788230,,,2016
135,"Atreya, A., Kunreuther, H.","Assessing community resilience: mapping the community rating system (CRS) against the 6C-4R frameworks","This paper introduces an holistic approach to assessing community resilience in the United States with respect to hazards by inventorying a community's strengths: Financial, Human, …",,,,,,,,,,,"GS Search 1",,//,"2024-10-03 23:12:33","2024-10-03 23:12:33",,10.4324/9781003171430-4/assessing-community-resilience-mapping-community-rating-system-crs-6c-4r-frameworks-ajita-atreya-howard-kunreuther,,,,,,,"Environmental Hazards and Resilience",,,,,,,,,"Cited By (since 2021): 12",,,,,,,,,,,,,,,,,"Assessing community resilience: mapping the community rating system (CRS) against the 6C-4R frameworks",,,,JOUR,,https://www.taylorfrancis.com/chapters/edit/10.4324/9781003171430-4/assessing-community-resilience-mapping-community-rating-system-crs-6c-4r-frameworks-ajita-atreya-howard-kunreuther,,,2021
136,"Bandyopadhyay, Chandrani, Philip, P. J.","A Safe City Approach to Urban Sustainability: Developing a Framework for Community Resilience","… sinking, vector-borne diseases and epidemics, extreme heat and cold wave leads to higher morbidity and mortality, heat island effect, increased energy demand, water and air pollution, …",,,,,,,,,,,"GS Search 1",,//,"2024-10-03 23:12:33","2024-10-03 23:12:33",,10.1177/0019556120150103,,,,,"0019-5561 2457-0222",1,"Indian Journal of Public Administration",,,,,,,,,"Cited By (since 2015): 3",,,,,,,40-56,,,,,,,,,40,"A Safe City Approach to Urban Sustainability: Developing a Framework for Community Resilience",,,,JOUR,,https://journals.sagepub.com/doi/abs/10.1177/0019556120150103,,61,2017
137,"Bento, F., Couto, K. C.","A behavioral perspective on community resilience during the COVID-19 pandemic: The case of Paraisópolis in São Paulo, Brazil","… lack of a general framework combining multidisciplinary aspects of community resilience [23]… registered lower levels of social distancing and higher contamination and death rates [53,54]…",,,,,,,,,,,"GS Search 1",,//,"2024-10-03 23:12:33","2024-10-03 23:12:33",,,,,,,,,Sustainability,,,,,,,,,"Cited By (since 2021): 46",,,,,,,,,,,,,,,,,"A behavioral perspective on community resilience during the COVID-19 pandemic: The case of Paraisópolis in São Paulo, Brazil",,,,JOUR,,https://www.mdpi.com/2071-1050/13/3/1447,,,2021
138,"Berkes, F., Ross, H.","Panarchy and community resilience: Sustainability science and policy implications","… to other levels, the ways in which community resilience is impacted, and the implications of … illustrate a diversity of ways in which community resilience is shaped in a multi-level world. …",,,,,,,,,,,"GS Search 1",,//,"2024-10-03 23:12:33","2024-10-03 23:12:33",,,,,,,,,"Environmental Science &Policy",,,,,,,,,"Cited By (since 2016): 261",,,,,,,,,,,,,,,,,"Panarchy and community resilience: Sustainability science and policy implications",,,,JOUR,,"https://www.sciencedirect.com/science/article/pii/S1462901116300843 https://slunik.slu.se/kursfiler/MX0127/20050.1920/5_Berket_o_Rss_2016_ERAUQ386526-2.pdf",,,2016
139,"Bhatta, R., Loc, H. H., Babel, M. S., Chapagain, K.","Assessment and enhancement of community water supply system sustainability: A dual Framework Approach","… For example, a SMART goal for reducing water pollution might be to reduce the … improves sustainability outcomes but also strengthens community resilience and cohesion. …",,,,,,,,,,,"GS Search 1",,//,"2024-10-03 23:12:33","2024-10-03 23:12:33",,,,,,,,,"… and Sustainability Indicators",,,,,,,,,,,,,,,,,,,,,,,,,,"Assessment and enhancement of community water supply system sustainability: A dual Framework Approach",,,,JOUR,,https://www.sciencedirect.com/science/article/pii/S2665972724001545,,,2024
140,"Braga, M. F.","Building Community Resilience: A Design Perspective","… Rational choice theory is an analytical framework in neoclassical economics for understanding and modeling the social and economic behavior of groups of people – for example, the …",,,,,,,,,,,"GS Search 1",,//,"2024-10-03 23:12:33","2024-10-03 23:12:33",,10.1007/978-3-030-87745-3_232,,,,,,,"The Palgrave Encyclopedia of Urban and Regional …",,,,,,,,,,,,,,,,,,,,,,,,,,"Building Community Resilience: A Design Perspective",,,,JOUR,,https://link.springer.com/content/pdf/10.1007/978-3-030-87745-3_232.pdf,,,2023
141,"Brose, D. A.","Developing a framework for measuring community resilience: Summary of a workshop","… framework, the Resilient America Roundtable of the National Academies convened the workshop Measures of Community Resilience: … to begin to develop a framework of measures and …",,,,,,,,,,,"GS Search 1",,,"2024-10-03 23:12:33","2024-10-03 23:12:33",,,,,,,,,,,,,,,,,,"Cited By (since 2015): 31","Query date: 2024-09-27 10:20:05",,,,,,,,,,books.google.com,,,,,,"Developing a framework for measuring community resilience: Summary of a workshop",,,,BOOK,,https://books.google.com/books?hl=en&lr=&id=73H2BwAAQBAJ&oi=fnd&pg=PT17&dq=framework+%22community+resilience%22+pollution%7Cpolluted%7Cpollutants%7Ccontamination%7Ccontaminated%7Ccontaminants%7Ccontaminates&ots=ZEZbYI7MR_&sig=x2Cn_MrcP3uJqVfu2KFjb1Oe290,,,2015
142,"Camacho, C., Bower, P., Webb, R. T., Munford, L.","Measurement of community resilience using the Baseline Resilience Indicator for Communities (BRIC) framework: A systematic review","… Eighteen indicators such as pollution control equipment, protective clothing, harbour capacity and pre-existing marine pollution were used to construct an HNS-specific index. Validation …",,,,,,,,,,,"GS Search 1",,//,"2024-10-03 23:12:33","2024-10-03 23:12:33",,,,,,,,,"International journal of …",,,,,,,,,"Cited By (since 2023): 14",,,,,,,,,,,,,,,,,"Measurement of community resilience using the Baseline Resilience Indicator for Communities (BRIC) framework: A systematic review",,,,JOUR,,https://www.sciencedirect.com/science/article/pii/S2212420923003503,,,2023
143,"Choi, Juyeong, Deshmukh, Abhijeet, Hastak, Makarand","Seven-Layer Classification of Infrastructure to Improve Community Resilience to Disasters","… Therefore, the availability of a framework in which … platform for planning community resilience within the framework of seven … The proposed framework starts by identifying the primary …",,,,,,,,,,,"GS Search 1",,//,"2024-10-03 23:12:33","2024-10-03 23:12:33",,10.1061/(asce)is.1943-555x.0000486,,,,,"1076-0342 1943-555X",2,"Journal of Infrastructure Systems",,,,,,,,,"Cited By (since 2019): 36",,,,,,,,,,,,,,,,,"Seven-Layer Classification of Infrastructure to Improve Community Resilience to Disasters",,,,JOUR,,https://ascelibrary.org/doi/abs/10.1061/(ASCE)IS.1943-555X.0000486,,25,2019
144,"Clark, T. D., Solutions, W. S. S.","Natural disasters, vulnerability, and resilience in indigenous communities: Literature review and conceptual framework","… of burned hectares and the resultant contamination of air, water, … community resilience and adaptive capacity, which will help … and implement programs to increase community resilience …",,,,,,,,,,,"GS Search 1",,//,"2024-10-03 23:12:33","2024-10-03 23:12:33",,,,,,,,,,,,,,,,,,"Cited By (since 2017): 2",,,,,,,,,,,,,,,,,"Natural disasters, vulnerability, and resilience in indigenous communities: Literature review and conceptual framework",,,,JOUR,,https://www.academia.edu/download/55029697/Rebuilding_Resilience_Indigenous_Communities_-_Literature_Review_Report_Final.pdf,,,2017
145,"Colker, R.","Optimizing community infrastructure: Resilience in the face of shocks and stresses","… air and water pollution, acid mine drainage, and polluted soils. … approach to achieving community resilience, it largely … capabilities in the National Mitigation Framework and assesses …",,,,,,,,,,,"GS Search 1",,,"2024-10-03 23:12:33","2024-10-03 23:12:33",,,,,,,,,,,,,,,,,,"Cited By (since 2019): 11","Query date: 2024-09-27 10:20:05",,,,,,,,,,books.google.com,,,,,,"Optimizing community infrastructure: Resilience in the face of shocks and stresses",,,,BOOK,,https://books.google.com/books?hl=en&lr=&id=gpe2DwAAQBAJ&oi=fnd&pg=PP1&dq=framework+%22community+resilience%22+pollution%7Cpolluted%7Cpollutants%7Ccontamination%7Ccontaminated%7Ccontaminants%7Ccontaminates&ots=Ub_zttn9Js&sig=nsnTOsIZ-a8bsVrKe5pwS3QFzn8,,,2019
146,"Comes, T.","Designing for networked community resilience","… One common resilience framework is focused on “4 Es”: … to address issues of energy, pollution, transportation, water … term considerations, a theoretical framework is proposed for …",,,,,,,,,,,"GS Search 1",,//,"2024-10-03 23:12:33","2024-10-03 23:12:33",,,,,,,,,"Procedia engineering",,,,,,,,,"Cited By (since 2016): 48",,,,,,,,,,,,,,,,,"Designing for networked community resilience",,,,JOUR,,"https://www.sciencedirect.com/science/article/pii/S1877705816321993 https://www.sciencedirect.com/science/article/pii/S1877705816321993/pdf?md5=831cdf83a295f2cbf8aa1b0b01699e33&pid=1-s2.0-S1877705816321993-main.pdf",,,2016
147,"Cui, Peng, Li, Dezhi","Measuring the Disaster Resilience of an Urban Community Using ANP‐FCE Method from the Perspective of Capitals","… (2) Establishing a convenient and quantifiable framework to measure community resilience … The pump station in the basement was flooded and the drinking water was polluted. These …",,,,,,,,,,,"GS Search 1",,//,"2024-10-03 23:12:33","2024-10-03 23:12:33",,10.1111/ssqu.12699,,,,,"0038-4941 1540-6237",6,"Social Science Quarterly",,,,,,,,,"Cited By (since 2019): 29",,,,,,,2059-2077,,,,,,,,,2059,"Measuring the Disaster Resilience of an Urban Community Using ANP‐FCE Method from the Perspective of Capitals",,,,JOUR,,https://onlinelibrary.wiley.com/doi/abs/10.1111/ssqu.12699,,100,2019
148,"Cui, P., Li, D.","A SNA-based methodology for measuring the community resilience from the perspective of social capitals: Take Nanjing, China as an example","… For example, F Community have cleaned the garbage, waste and other pollutants in a … a SNA-based assessment framework of community resilience from the perspective of capitals. …",,,,,,,,,,,"GS Search 1",,//,"2024-10-03 23:12:33","2024-10-03 23:12:33",,,,,,,,,"Sustainable Cities and Society",,,,,,,,,"Cited By (since 2020): 55",,,,,,,,,,,,,,,,,"A SNA-based methodology for measuring the community resilience from the perspective of social capitals: Take Nanjing, China as an example",,,,JOUR,,https://www.sciencedirect.com/science/article/pii/S221067071931488X,,,2020
149,"Daniel, Liba, Mazumder, Ram K., Enderami, S. Amin, Sutley, Elaina J., Lequesne, Rémy D.","Community Capitals Framework for Linking Buildings and Organizations for Enhancing Community Resilience through the Built Environment","The goal of this paper is to define a quantitative measurement system capable of capturing multiple dimensions of a community impacted by disaster. The multiple dimensions of a …",,,,,,,,,,,"GS Search 1",,//,"2024-10-03 23:12:33","2024-10-03 23:12:33",,10.1061/(asce)is.1943-555x.0000668,,,,,"1076-0342 1943-555X",1,"Journal of Infrastructure Systems",,,,,,,,,"Cited By (since 2022): 14",,,,,,,,,,,,,,,,,"Community Capitals Framework for Linking Buildings and Organizations for Enhancing Community Resilience through the Built Environment",,,,JOUR,,"https://ascelibrary.org/doi/full/10.1061/(ASCE)IS.1943-555X.0000668 https://drive.google.com/file/d/1BAYpKTLOPjwLDgAsqLS9hemAFinExR68/view",,28,2022
150,"Derakhshan, S., Blackwood, L., Habets, M., Effgen, J. F.","Prisoners of scale: downscaling community resilience measurements for enhanced use","… help progress community resilience quantification schemes, … conceptual relevance in the framework of resilience capitals, … Water quality risk NPDES point source pollution facilities in …",,,,,,,,,,,"GS Search 1",,//,"2024-10-03 23:12:33","2024-10-03 23:12:33",,,,,,,,,Sustainability,,,,,,,,,"Cited By (since 2022): 13",,,,,,,,,,,,,,,,,"Prisoners of scale: downscaling community resilience measurements for enhanced use",,,,JOUR,,https://www.mdpi.com/2071-1050/14/11/6927,,,2022
151,"Deshkar, S., Adane, V.","Community resilience approach for prioritizing infrastructure development in urban areas","… framework that can help the authorities to adopt an appropriate approach for infrastructure planning, focusing on generating community resilience… of environmental pollution and hazard …",,,,,,,,,,,"GS Search 1",,//,"2024-10-03 23:12:33","2024-10-03 23:12:33",,,,,,,,,"Urban disasters and resilience in Asia",,,,,,,,,"Cited By (since 2016): 17",,,,,,,,,,,,,,,,,"Community resilience approach for prioritizing infrastructure development in urban areas",,,,JOUR,,"https://www.sciencedirect.com/science/article/pii/B9780128021699000161 https://www.researchgate.net/profile/Sameer-Deshkar/publication/303414677_Community_Resilience_Approach_for_Prioritizing_Infrastructure_Development_in_Urban_Areas/links/5ac9dbb8aca272abdc615855/Community-Resilience-Approach-for-Prioritizing-Infrastructure-Development-in-Urban-Areas.pdf",,,2016
152,"Erwin, A., Ma, Z., Popovici, R., O'Brien, E. P. S., Zanotti, L.","Linking migration to community resilience in the receiving basin of a large-scale water transfer project","… like pollution, social inequality, and unclear land rights, heighten the vulnerabilities and decrease community resilience in … as well as presents a framework for better understanding how …",,,,,,,,,,,"GS Search 1",,//,"2024-10-03 23:12:33","2024-10-03 23:12:33",,,,,,,,,"Land Use Policy",,,,,,,,,"Cited By (since 2022): 8",,,,,,,,,,,,,,,,,"Linking migration to community resilience in the receiving basin of a large-scale water transfer project",,,,JOUR,,https://www.sciencedirect.com/science/article/pii/S0264837721006232,,,2022
153,"Finucane, Melissa L., Blum, Michael J., Ramchand, Rajeev, Parker, Andrew M., Nataraj, Shanthi, Clancy, Noreen, Cecchine, Gary, Chandra, Anita, Slack, Tim, Hobor, George, Ferreira, Regardt J., Luu, Ky, Lesen, Amy E., Bond, Craig A.","Advancing community resilience research and practice: moving from “me” to “we” to “3D”","Research and practice aimed at enhancing community resilience to disasters such as hurricanes have focused primarily on the survival of individuals and the development of social capital and networks. Less consideration has been given to the dynamics of social-ecological conditions that can govern post-disaster outcomes. This article provides a rationale for moving research and practice towards an adaptive systems framework, drawing on the cascading challenges that Gulf of Mexico coastal communities have endured since the 2010 Deepwater Horizon (DWH) oil spill. The adaptive approach recognizes that, in some situations, crises can highlight avenues for improvement, where greater resilience can be achieved by addressing the dynamic context of a disaster. We discuss implications for clarifying interdependencies, bridging the science-society gap, and making course corrections through iterative processes. We also highlight how the approach might foster policy addressing global challenges such as changing climate conditions, rapid urbanization, and disease pandemics.",,,,,,,,,,,"GS Search 1",,//,"2024-10-03 23:12:33","2024-10-03 23:12:33",,10.1080/13669877.2018.1517377,,,,,"1366-9877 1466-4461",1,"Journal of Risk Research",,,,,,,,,"Cited By (since 2020): 17",,,,,,,1-10,,,,,,,,,1,"Advancing community resilience research and practice: moving from “me” to “we” to “3D”",,,,JOUR,,"https://www.tandfonline.com/doi/abs/10.1080/13669877.2018.1517377 https://www.academia.edu/download/89827479/13669877.2018.151737720220817-1-15zb7pm.pdf",,23,2019
154,"Fox-Lent, Cate, Bates, Matthew E., Linkov, Igor","A matrix approach to community resilience assessment: an illustrative case at Rockaway Peninsula","… sanitation works have released contaminants into the bay and … community resilience assessment method with specific strengths over existing methods. The RM provides a framework …",,,,,,,,,,,"GS Search 1",,//,"2024-10-03 23:12:33","2024-10-03 23:12:33",,10.1007/s10669-015-9555-4,,,,,"2194-5403 2194-5411",2,"Environment Systems and Decisions",,,,,,,,,"Cited By (since 2015): 137",,,,,,,209-218,,,,,,,,,209,"A matrix approach to community resilience assessment: an illustrative case at Rockaway Peninsula",,,,JOUR,,"https://link.springer.com/article/10.1007/s10669-015-9555-4 https://www.researchgate.net/profile/Matthew-Bates-9/publication/278680330_A_matrix_approach_to_community_resilience_assessment_An_illustrative_case_at_Rockaway_Peninsula/links/63d43783c97bd76a823f355c/A-matrix-approach-to-community-resilience-assessment-An-illustrative-case-at-Rockaway-Peninsula.pdf?origin=journalDetail&_tp=eyJwYWdlIjoiam91cm5hbERldGFpbCJ9",,35,2015
155,"Gerhardstein, B., Rayman, J.","Community Psychosocial Stress and Environmental Contamination: From Theory to Practice","… contamination. In addition, we sought to identify strategies for strengthening community resilience to this … In particular, our objectives were to (1) develop a theoretical framework for …",,,,,,,,,,,"GS Search 1",,//,"2024-10-03 23:12:33","2024-10-03 23:12:33",,,,,,,,,"… Annual Meeting and Expo (Oct. 24 …",,,,,,,,,,,,,,,,,,,,,,,,,,"Community Psychosocial Stress and Environmental Contamination: From Theory to Practice",,,,JOUR,,https://apha.confex.com/apha/2020/meetingapi.cgi/Session/61156?filename=2020_Session61156.html&template=Word,,,2020
156,"Glass, Jayne, McMorran, Rob, Currie, Margaret, McKee, Annie, Pinker, Annabel, Reed, Mark, Meador, Elliot, Markantoni, Marianna","Translating community resilience theory into practice: A deliberative Delphi approach","… This article, therefore, responds to this gap in understanding by developing a novel and practical framework for translating rural community resilience theory into practice to provide …",,,,,,,,,,,"GS Search 1",,//,"2024-10-03 23:12:33","2024-10-03 23:12:33",,10.1111/soru.12397,,,,,"0038-0199 1467-9523",4,"Sociologia Ruralis",,,,,,,,,"Cited By (since 2022): 17",,,,,,,675-698,,,,,,,,,675,"Translating community resilience theory into practice: A deliberative Delphi approach",,,,JOUR,,"https://onlinelibrary.wiley.com/doi/abs/10.1111/soru.12397 https://onlinelibrary.wiley.com/doi/pdfdirect/10.1111/soru.12397",,62,2022
157,"Goyal, N.","Disaster governance and community resilience: The law and the role of SDMAs","… no longer be ignored in the framework of disaster cycle. In a … can help in building community resilience and ensuring … water bodies and river bed pollution due to incessant illegal …",,,,,,,,,,,"GS Search 1",,//,"2024-10-03 23:12:33","2024-10-03 23:12:33",,,,,,,,,"International Journal of Disaster Risk Management",,,,,,,,,"Cited By (since 2019): 41",,,,,,,,,,,,,,,,,"Disaster governance and community resilience: The law and the role of SDMAs",,,,JOUR,,"https://www.ceeol.com/search/article-detail?id=946697 http://internationaljournalofdisasterriskmanagement.com/index.php/Vol1/article/download/12/10",,,2019
158,"Grymes, James, Newman, Alexandra, Cranmer, Zana, Nock, Destenie","Optimizing microgrid deployment for community resilience","… consequences from resulting air pollution exposure. Fuel cells … Our optimization framework considers how fuel cells, … , and create a cost-benefit framework for the responsible civic …",,,,,,,,,,,"GS Search 1",,//,"2024-10-03 23:12:33","2024-10-03 23:12:33",,10.1007/s11081-023-09844-6,,,,,"1389-4420 1573-2924",3,"Optimization and Engineering",,,,,,,,,,,,,,,,1297-1331,,,,,,,,,1297,"Optimizing microgrid deployment for community resilience",,,,JOUR,,https://link.springer.com/article/10.1007/s11081-023-09844-6,,25,2023
