"Refid","Author","Title","Abstract","Accession Number","Art. no.","Article Number","Author Address","Author keywords","Author(s) id","Cited by","Comments","Custom 4","Custom 5","Database","Database Provider","Date","distiller_reference_created_date","distiller_reference_upload_date","Document type","DOI","Eid","Epub Date","File attachment","Index keywords","ISSN","Issue","Journal","Keywords","Label","Language","Legal Note","Level","Link","min_level","NIHMSID","Notes","Number","Open access","Original Publication","Page count","Page end","Page start","Pages","Place Published","PMCID","Publication stage","Publisher","Pubmed id","Rapidscreening","Research Notes","Secondary Author","Section","Short Title","Source","Source title","Translated Title","Type","Type of Work","URL","User","Volume","Year"
256,"Rosenbloom, J.","Fifty shades of gray infrastructure: Land use and the failure to create resilient cities","… , adaptive infrastructure to create more resilient communities. … [L]oss of biodiversity, degraded land, diffuse air pollution, … processes, adaptive legal frameworks, and adaptive governance …",,,,,,,,,,,"GS Search 1b",,//,"2024-10-03 23:12:34","2024-10-03 23:12:34",,,,,,,,,"Wash. L. Rev.",,,,,,,,,"Cited By (since 2018): 54",,,,,,,,,,,,,,,,,"Fifty shades of gray infrastructure: Land use and the failure to create resilient cities",,,,JOUR,,"https://heinonline.org/hol-cgi-bin/get_pdf.cgi?handle=hein.journals/washlr93&section=9 https://digitalcommons.law.uw.edu/cgi/viewcontent.cgi?article=5025&context=wlr",,,2018
257,"Santos, A., Sousa, N., Kremers, H., Bucho, J. L.","Building resilient urban communities: the case study of setubal municipality, Portugal","The Sendai Framework for Disaster Risk Reduction provides several guidelines that countries should follow. Still, some scientific papers discussed the limitations, difficulties, and …",,,,,,,,,,,"GS Search 1b",,//,"2024-10-03 23:12:34","2024-10-03 23:12:34",,,,,,,,,Geosciences,,,,,,,,,"Cited By (since 2020): 22",,,,,,,,,,,,,,,,,"Building resilient urban communities: the case study of setubal municipality, Portugal",,,,JOUR,,https://www.mdpi.com/2076-3263/10/6/243,,,2020
258,"Scalingi, P. L.","Creating wildfire-resilient communities","… , large-scale wildfire smoke has contaminated citrus in orchards and … It also leads to contamination of soils and groundwater, … offers a ready-made framework that can be customized …",,,,,,,,,,,"GS Search 1b",,//,"2024-10-03 23:12:34","2024-10-03 23:12:34",,10.1007/978-3-030-42462-6_11,,,,,,,"The Palgrave Handbook of Climate Resilient Societies",,,,,,,,,"Cited By (since 2022): 3",,,,,,,,,,,,,,,,,"Creating wildfire-resilient communities",,,,JOUR,,https://link.springer.com/content/pdf/10.1007/978-3-030-42462-6_11.pdf,,,2022
259,"Singh, S. K., Taylor, R. W., Thadaboina, V.","Evaluating and predicting social behavior of arsenic affected communities: Towards developing arsenic resilient society","… Less resilient communities and the environment are more susceptible to vulnerability [16]. Therefore, quantifying social resilience and its predictors will help understand the coping …",,,,,,,,,,,"GS Search 1b",,//,"2024-10-03 23:12:34","2024-10-03 23:12:34",,,,,,,,,"Emerging Contaminants",,,,,,,,,"Cited By (since 2022): 5",,,,,,,,,,,,,,,,,"Evaluating and predicting social behavior of arsenic affected communities: Towards developing arsenic resilient society",,,,JOUR,,https://www.sciencedirect.com/science/article/pii/S2405665021000226,,,2022
260,"Sittenfeld, D.","Citizen Science, Civics, and Resilient Communities: Co-Created Science-to-Civics to Facilitate Equitable Climate Resilience Planning","… of extreme heat and particulate pollution. In each chapter, I … framework, I describe its application to a national NOAA-funded project, Citizen Science, Civics, and Resilient Communities …",,,,,,,,,,,"GS Search 1b",,,"2024-10-03 23:12:34","2024-10-03 23:12:34",,,,,,,,,,,,,,,,,,,"Query date: 2024-09-27 11:08:34",,,,,,,,,,search.proquest.com,,,,,,"Citizen Science, Civics, and Resilient Communities: Co-Created Science-to-Civics to Facilitate Equitable Climate Resilience Planning",,,,BOOK,,https://search.proquest.com/openview/8553ae92c51acf67d2182fa481c5775f/1?pq-origsite=gscholar&cbl=18750&diss=y,,,2022
261,"Stamatopoulos, E., Forouli, A., Stoian, D.","An adaptive framework for assessing climate resilience in buildings","As global climates continue to evolve, the urgency to enhance built environments against environmental challenges becomes more pronounced. Inspired by the Smart Readiness Indicator (SRI)—a system for assessing a building’s smart readiness—this study introduces a framework to assess and evaluate climate resilience in buildings. The framework assesses a building’s ability to anticipate, prepare for, respond to, and recover from adverse climate-related events. It begins with a climate exposure analysis that examines certain hazards and incorporates historical weather data for a comprehensive exposure analysis. Based on this analysis, a structured and quantifiable approach is employed to assess and benchmark the resilience of different building typologies across several domains. The assessment is grounded in qualitative analysis through extensive literature research, institutional guidelines, and best practices. It also employs a dynamic weighting based on the exposure assessment of a building’s location, assigning resilience importance according to the climate risks faced. Initially applied to two buildings in Athens, Greece, and Helsinki, Finland — locations with significantly different climatic characteristics — the framework was then tested in experimental simulations. These simulations highlight the framework’s adaptability to different climatic conditions. Finally, we summarize the major findings of the research, emphasizing its importance in promoting climate-resilient building practices, supporting the inventory of building stock, and aiding decision-making against increasingly intense and frequent climate risks.",,,,,,,,,,,"GS Search 1b",,//,"2024-10-03 23:12:34","2024-10-03 23:12:34",,,,,,,,,"Building and …",,,,,,,,,"Cited By (since 2024): 1",,,,,,,,,,,,,,,,,"An adaptive framework for assessing climate resilience in buildings",,,,JOUR,,https://www.sciencedirect.com/science/article/pii/S036013232400711X,,,2024
262,"Sun, L., Li, H., Nagel, J., Yang, S.","Convergence of AI and urban emergency responses: Emerging pathway toward resilient and equitable communities","… of resilient communities by proposing a comprehensive definition of hazard resilience in urban areas. Their framework … -initiated releases of radioactive contamination or other toxic …",,,,,,,,,,,"GS Search 1b",,//,"2024-10-03 23:12:34","2024-10-03 23:12:34",,,,,,,,,"Applied Sciences",,,,,,,,,,,,,,,,,,,,,,,,,,"Convergence of AI and urban emergency responses: Emerging pathway toward resilient and equitable communities",,,,JOUR,,https://www.mdpi.com/2076-3417/14/17/7949,,,2024
263,"Syahrir, R., Wall, F., Diallo, P.","Coping with sudden mine closure: The importance of resilient communities and good governance","… preconditions or favourable frameworks to generate resilient communities is crucial for … After mining, the prevention of pollution and land rehabilitation is mainly the mining company's …",,,,,,,,,,,"GS Search 1b",,//,"2024-10-03 23:12:34","2024-10-03 23:12:34",,,,,,,,,"The Extractive Industries and Society",,,,,,,,,"Cited By (since 2021): 26",,,,,,,,,,,,,,,,,"Coping with sudden mine closure: The importance of resilient communities and good governance",,,,JOUR,,https://www.sciencedirect.com/science/article/pii/S2214790X21001805,,,2021
264,"Tabb, Phillip James","Biophilic Urbanism","… Tabb’s book is a highly useful addition, providing both a systematic framework for … that neighborhoods experiencing higher levels of air pollution (mostly lower-income neighborhoods of …",,,,,,,,,,,"GS Search 1b",,,"2024-10-03 23:12:34","2024-10-03 23:12:34",,10.4324/9781003034896,,,,,9781003034896,,,,,,,,,,,"Cited By (since 2020): 35","Query date: 2024-09-27 11:08:34",,,,,,,,,,taylorfrancis.com,,,,,,"Biophilic Urbanism",,,,BOOK,,"https://www.taylorfrancis.com/books/mono/10.4324/9781003034896/biophilic-urbanism-phillip-james-tabb https://scholar.archive.org/work/j2wxdxpwgrhhljr32rjqdixsve/access/wayback/https://s3-euw1-ap-pe-ws4-capi2-distribution-p.s3-eu-west-1.amazonaws.com/books/9781003034896/HUB/googleScholarPdf.pdf?response-content-disposition=attachment%3B%20filename%3D%229781003034896_googlepreview.pdf%22&response-content-type=application%2Fpdf&x-amz-security-token=IQoJb3JpZ2luX2VjEDIaCWV1LXdlc3QtMSJIMEYCIQCnUBIWI24HXv5QKZk2ERu29WhY2X79ANiM0kfjdDRpCQIhALIXCQIXClgaynIWQ2wiJ6bWHSwsVwQKgpDV22AFNUinKr0DCLv%2F%2F%2F%2F%2F%2F%2F%2F%2F%2FwEQAhoMMDEyMTc3MjY0NTExIgwTQ10FZcK3gGJOa3MqkQPvTUidG%2F0%2FjzJnsEcM8gmO7DuVUOyW6f4GZsM0i%2FqZG5HtckuMzygli9xXin0ImZL%2FfSC8RCgGcd9BsenbYmhPrS3gHCMmyFonKVwR4FWBh2FZFYt6RJBM8K%2Bus%2B%2BNKlyuwFEZkQAbTKqvMDMpqMcN%2Fu1UCYxfdDWz8%2F6udA9x23wnLtIcZWVGZ7Ei3fI%2FtlzLSsFndyCcdevUO2AdfVMzwqoZ6gQahSdqsxheiTa4ae9PK090QTS%2FZRMlNDEEkfikyCw0ljtB70C9XCFqrLx2r6vDi4fqFA2KaNTcDQBitM7OZScTGVWMgepcvsx2WN1MHTH0klMzNRhsGo65%2BcdMEiZi%2BLMHa8Qr1NLZVWPtEExh3d3M3nKXaMMWrFULFj4mizJyNK22asiFC%2FTI8nyCqGJtNTTXkL3TG3Dg7S3mTAWl8Y%2FL46Rl0gYKpTv9Oz4ECyszeP6WZd4Tp3emu9UC%2BWjvyIMNxCSeygWoxY%2FORiytKQi8vE8Nc0kAXI%2BLDIZ03u6laWu9hPEJXHLyIIxBTzCR5aL%2BBTrqAWDJCXiXrtWCfoPU%2FGw%2FTcT20wiuIUO3H2e9Af492v%2B5z%2Fp0B4mButYcZAsV9p%2F67y1Q9CQP7HynWD9kewaSEnzyf9QqmE%2BZLtHjVHOgETFoo5GXZTJ53C87%2FYA8ahYsTGYvwRb31BTzV0jeRa0ZxnZyN6zay8Qb61N971sV5tZC8vXRdYr9VlXoySBdQey4qOq3Cqgh8aR4Tfizi2DcOYWFRXLDV3PA9a9lsk53zWe6zOvMZ%2FvjMlGjzz25ToTJFTI%2BNJhmrQ2AP6jaZACF1MjCIAYOZd%2FQN2Fbhom3FZXVSqBa7zjhhQL4PQ%3D%3D&AWSAccessKeyId=ASIAQFVOSJ57ZFOEK4WS&Expires=1607596487&Signature=qN8MHfim6tVQpCjKB5c4xXqYwbg%3D",,,2020
265,"Taherkhani, R., Hashempour, N., Lotfi, M.","Sustainable-resilient urban revitalization framework: Residential buildings renovation in a historic district","… This article presents a sustainable-resilient urban revitalization framework called SRUR for the renovation of existing residential buildings in a historic district by applying the Delphi …",,,,,,,,,,,"GS Search 1b",,//,"2024-10-03 23:12:34","2024-10-03 23:12:34",,,,,,,,,"Journal of Cleaner Production",,,,,,,,,"Cited By (since 2021): 52",,,,,,,,,,,,,,,,,"Sustainable-resilient urban revitalization framework: Residential buildings renovation in a historic district",,,,JOUR,,https://www.sciencedirect.com/science/article/pii/S0959652620349969,,,2021
266,"Vetter, K.","The Institute of Resilient Communities [Book Chapter]","… The ongoing releases of contaminated water off the coast of … The Institute for Resilient Communities addresses this need … such a framework, the Institute for Resilient Communities is a …",,,,,,,,,,,"GS Search 1b",,,"2024-10-03 23:12:34","2024-10-03 23:12:34",,,,,,,,,,,,,,,,,,,"Query date: 2024-09-27 11:08:34",,,,,,,,,,osti.gov,,,,,,"The Institute of Resilient Communities [Book Chapter]",,,,BOOK,,"https://www.osti.gov/biblio/1455069 https://www.osti.gov/servlets/purl/1455069",,,2017
267,"Wright, K.","Resilient communities? Experiences of risk and resilience in a time of austerity","… The Labour government introduced new legislative frameworks for emergencies during the 2000s, … Once known for its derelict and polluted landscape, left as a legacy of departed local …",,,,,,,,,,,"GS Search 1b",,//,"2024-10-03 23:12:34","2024-10-03 23:12:34",,,,,,,,,"International Journal of Disaster Risk Reduction",,,,,,,,,"Cited By (since 2016): 62",,,,,,,,,,,,,,,,,"Resilient communities? Experiences of risk and resilience in a time of austerity",,,,JOUR,,"https://www.sciencedirect.com/science/article/pii/S2212420916301169 https://eprints.whiterose.ac.uk/100549/3/Revised_resilience_risk.pdf",,,2016
268,"Wu, C., Cenci, J., Wang, W., Zhang, J.","Resilient City: Characterization, Challenges and Outlooks. Buildings 2022, 12, 516","… Abstract: The increasingly severe environmental pollution … of resilience as an analytical framework for urban issues, and … the risk of building resilient communities, and improve the level …",,,,,,,,,,,"GS Search 1b",,//,"2024-10-03 23:12:34","2024-10-03 23:12:34",,,,,,,,,,,,,,,,,,"Cited By (since 2022): 1",,,,,,,,,,,,,,,,,"Resilient City: Characterization, Challenges and Outlooks. Buildings 2022, 12, 516",,,,JOUR,,https://www.academia.edu/download/95638483/pdf.pdf,,,2022
269,"Zamanian, S., Rahimi, M., Shafieezadeh, A.","Resilience of sewer networks to extreme weather hazards: Past experiences and an assessment framework","… , and support tools to build resilient communities are elaborated for those case studies. … Chemical and biological contamination of drinking water due to the overflow of wastewater …",,,,,,,,,,,"GS Search 1b",,//,"2024-10-03 23:12:34","2024-10-03 23:12:34",,10.1061/9780784483213.006,,,,,,,"Pipelines 2020",,,,,,,,,"Cited By (since 2020): 13",,,,,,,,,,,,,,,,,"Resilience of sewer networks to extreme weather hazards: Past experiences and an assessment framework",,,,JOUR,,https://ascelibrary.org/doi/abs/10.1061/9780784483213.006,,,2020
270,"Zhang, M., Peng, C., Shu, J., Lin, Y.","Territorial resilience of metropolitan regions: a conceptual framework, recognition methodologies and planning response—a case study of Wuhan …","… multi-scale spatial forms such as resilient communities, resilient cities and resilient regions. … and to protect themselves from natural disasters, pollution, and other life-threatening health …",,,,,,,,,,,"GS Search 1b",,//,"2024-10-03 23:12:34","2024-10-03 23:12:34",,,,,,,,,"International Journal of Environmental …",,,,,,,,,"Cited By (since 2022): 10",,,,,,,,,,,,,,,,,"Territorial resilience of metropolitan regions: a conceptual framework, recognition methodologies and planning response—a case study of Wuhan …",,,,JOUR,,https://www.mdpi.com/1660-4601/19/4/1914,,,2022
271,"Zhang, R.","Toward Resilient Communities–Vulnerability Assessments of Coupled Human and Natural Systems","… Additionally, this research aims to design a modeling framework that provides … be at higher risk for environmental hazards such as air pollution, extreme heat, and rising sea levels. For …",,,,,,,,,,,"GS Search 1b",,,"2024-10-03 23:12:34","2024-10-03 23:12:34",,,,,,,,,,,,,,,,,,,"Query date: 2024-09-27 11:08:34",,,,,,,,,,search.proquest.com,,,,,,"Toward Resilient Communities–Vulnerability Assessments of Coupled Human and Natural Systems",,,,BOOK,,https://search.proquest.com/openview/b5b5e48446599f0c407605189461f803/1?pq-origsite=gscholar&cbl=18750&diss=y,,,2024
272,"Aldrich, Daniel P., Meyer, Michelle A.","Social Capital and Community Resilience","… In this article, we review the definition of social capital and its application to community resilience before, during, and after disasters, illuminating methods for capturing it qualitatively …",,,,,,,,,,,"GS Search 1c",,//,"2024-10-03 23:12:34","2024-10-03 23:12:34",,10.1177/0002764214550299,,,,,"0002-7642 1552-3381",2,"American Behavioral Scientist",,,,,,,,,"Cited By (since 2015): 2419",,,,,,,254-269,,,,,,,,,254,"Social Capital and Community Resilience",,,,JOUR,,"https://journals.sagepub.com/doi/abs/10.1177/0002764214550299 https://www.academia.edu/download/37292506/American_Behavioral_Scientist-2014-Aldrich-0002764214550299.pdf",,59,2014
273,"Colten, Craig E., Grismore, Audrey A., Simms, Jessica R. Z.","Oil Spills and Community Resilience: Uneven Impacts and Protection in Historical Perspective","… and provides a useful framework for this discussion, but … in areas that were not polluted, by using geographic mobility. … within ten miles of the polluted area. This action effectively halted …",,,,,,,,,,,"GS Search 1c",,//,"2024-10-03 23:12:34","2024-10-03 23:12:34",,10.1111/j.1931-0846.2015.12085.x,,,,,"0016-7428 1931-0846",4,"Geographical Review",,,,,,,,,"Cited By (since 2015): 23",,,,,,,391-407,,,,,,,,,391,"Oil Spills and Community Resilience: Uneven Impacts and Protection in Historical Perspective",,,,JOUR,,"https://www.tandfonline.com/doi/abs/10.1111/j.1931-0846.2015.12085.x https://www.academia.edu/download/85826888/j.1931-0846.2015.12085.x20220510-1-1ydnwux.pdf",,105,2019
274,"Fung, J. F., Zhang, Y., Johnson, K. J., Cook, D. T., Sattar, S.","Multidisciplinary research to advance the development of functional recovery for community resilience","… , equity and community resilience, and monitoring, enforcement, and evaluation) and open questions for the future of functional recovery in supporting community resilience goals. …",,,,,,,,,,,"GS Search 1c",,//,"2024-10-03 23:12:34","2024-10-03 23:12:34",,,,,,,,,,,,,,,,,,"Cited By (since 2023): 1",,,,,,,,,,,,,,,,,"Multidisciplinary research to advance the development of functional recovery for community resilience",,,,JOUR,,https://f.oaes.cc/xmlpdf/09cb8eca-d2e2-41be-8aed-3893529d0513/dpr2015_down.pdf,,,2023
275,"Gupta, N., Clavin, C. T., Petropoulos, Z. E., Mudd, A. B., Nek, R.","Case studies of community resilience policy","… The DROP model was considered as a starting point for developing a conceptual framework for this analysis for three primary reasons. First, the model considers rapid-onset hazards (…",,,,,,,,,,,"GS Search 1c",,,"2024-10-03 23:12:34","2024-10-03 23:12:34",,,,,,,,,,,,,,,,,,"Cited By (since 2016): 5","Query date: 2024-09-27 11:56:22",,,,,,,,,,kenya4resilience.org,,,,,,"Case studies of community resilience policy",,,,BOOK,,https://kenya4resilience.org/wp-content/uploads/2020/10/Case-Studies-of-Community-Resilience-Policy.pdf,,,2016
276,"Walker, A. H., McKinnon, L. R., Ritchie, L.","Oil Spill Preparedness and Response: Building the Capacity to Protect Public Welfare and Support Community Resilience","… The NCP defines the framework for pollution preparedness … federal agencies to coordinate pollution-related activities with … of hazardous substance, pollutants, and contaminants in the …",,,,,,,,,,,"GS Search 1c",,//,"2024-10-03 23:12:34","2024-10-03 23:12:34",,,,,,,,,"International Oil …",,,,,,,,,"Cited By (since 2021): 7",,,,,,,,,,,,,,,,,"Oil Spill Preparedness and Response: Building the Capacity to Protect Public Welfare and Support Community Resilience",,,,JOUR,,"https://meridian.allenpress.com/iosc/article-abstract/2021/1/689381/473287 https://www.researchgate.net/profile/Duane-Gill/publication/356771636_Oil_Spill_Preparedness_and_Response_Building_the_Capacity_to_Protect_Public_Welfare_and_Support_Community_Resilience/links/61b233e6d71e10491a9e6b3a/Oil-Spill-Preparedness-and-Response-Building-the-Capacity-to-Protect-Public-Welfare-and-Support-Community-Resilience.pdf?origin=journalDetail&_tp=eyJwYWdlIjoiam91cm5hbERldGFpbCJ9",,,2021
277,"Wang, Wanting, van de Lindt, John W., Rosenheim, Nathanael, Cutler, Harvey, Hartman, Brad, Sung Lee, Jong, Calderon, Diego","Effect of Residential Building Wind Retrofits on Social and Economic Community-Level Resilience Metrics","… Comprehensive community resilience assessment and improvement … 1 shows the framework for this study. … Financial shocks, health consequences of pollution, climate change, and…",,,,,,,,,,,"GS Search 1c",,//,"2024-10-03 23:12:34","2024-10-03 23:12:34",,10.1061/(asce)is.1943-555x.0000642,,,,,"1076-0342 1943-555X",4,"Journal of Infrastructure Systems",,,,,,,,,"Cited By (since 2021): 36",,,,,,,,,,,,,,,,,"Effect of Residential Building Wind Retrofits on Social and Economic Community-Level Resilience Metrics",,,,JOUR,,"https://ascelibrary.org/doi/full/10.1061/(ASCE)IS.1943-555X.0000642 https://www.researchgate.net/profile/Wanting-Wang-8/publication/353805173_Effect_of_Residential_Building_Wind_Retrofits_on_Social_and_Economic_Community-Level_Resilience_Metrics/links/6112adaa1ca20f6f86133a38/Effect-of-Residential-Building-Wind-Retrofits-on-Social-and-Economic-Community-Level-Resilience-Metrics.pdf",,27,2021
278,"Wright, Katy","Community Resilience","… The following three chapters of the book focus on key concepts and policy areas relevant to the topic of community resilience, to provide context and a framework for examining …",,,,,,,,,,,"GS Search 1c",,,"2024-10-03 23:12:34","2024-10-03 23:12:34",,10.4324/9780429448188,,,,,9780429448188,,,,,,,,,,,"Cited By (since 2021): 26","Query date: 2024-09-27 11:56:22",,,,,,,,,,taylorfrancis.com,,,,,,"Community Resilience",,,,BOOK,,https://www.taylorfrancis.com/books/mono/10.4324/9780429448188/community-resilience-katy-wright,,,2021
279,"Zhang, F., Wang, D., Zhou, X., Ye, F.","Community Resilience Evaluation and Construction Strategies in the Perspective of Public Health Emergencies: A Case Study of Six Communities in Nanjing","… evaluation framework for assessing community resilience, … social factors, a community resilience evaluation system with … lanes in order to reduce pollution from motor cars and expand …",,,,,,,,,,,"GS Search 1c",,//,"2024-10-03 23:12:34","2024-10-03 23:12:34",,,,,,,,,Sustainability,,,,,,,,,,,,,,,,,,,,,,,,,,"Community Resilience Evaluation and Construction Strategies in the Perspective of Public Health Emergencies: A Case Study of Six Communities in Nanjing",,,,JOUR,,https://www.mdpi.com/2071-1050/16/16/6992,,,2024
280,"Agrawal, A., Banfield, J., Cho, S., Kramarz, T.","Community Vulnerability to Extractive Industry Disasters","… As states and industries commit to further extraction of minerals and oil resources, it is increasingly important to understand the factors that compound community vulnerability and …",,,,,,,,,,,"GS Search 2",,//,"2024-10-03 23:12:34","2024-10-03 23:12:34",,10.1007/978-3-030-87745-3_179,,,,,,,"… Palgrave Encyclopedia of …",,,,,,,,,,,,,,,,,,,,,,,,,,"Community Vulnerability to Extractive Industry Disasters",,,,JOUR,,"https://link.springer.com/content/pdf/10.1007/978-3-030-87745-3_179.pdf https://www.researchgate.net/profile/Teresa-Kramarz-2/publication/367137451_Community_Vulnerability_to_Extractive_Industry_Disasters/links/640b5025315dfb4cce6ee374/Community-Vulnerability-to-Extractive-Industry-Disasters.pdf",,,2023
281,"Alessa, L., Valentine, J., Moon, S., McComb, C., Hicks, S.","Toward a Permafrost Vulnerability Index for Critical Infrastructure, Community Resilience and National Security","… using different composite indices and frameworks can be augmented. … problem involving location: pollution models, disease … integrated version of community vulnerability as Equation (2)…",,,,,,,,,,,"GS Search 2",,//,"2024-10-03 23:12:34","2024-10-03 23:12:34",,,,,,,,,Geographies,,,,,,,,,"Cited By (since 2023): 3",,,,,,,,,,,,,,,,,"Toward a Permafrost Vulnerability Index for Critical Infrastructure, Community Resilience and National Security",,,,JOUR,,https://www.mdpi.com/2673-7086/3/3/27,,,2023
282,"Ali, A. A. B.","Spatial risk assessment of social vulnerability to contaminated river water: A case study of Coosa River watershed","… this study develops a framework capable of integrating the location of agricultural and industrial activity, flood prone areas, and community vulnerability. This framework is applied to the …",,,,,,,,,,,"GS Search 2",,,"2024-10-03 23:12:34","2024-10-03 23:12:34",,,,,,,,,,,,,,,,,,,"Query date: 2024-09-27 10:24:01",,,,,,,,,,etd.auburn.edu,,,,,,"Spatial risk assessment of social vulnerability to contaminated river water: A case study of Coosa River watershed",,,,BOOK,,"https://etd.auburn.edu/handle/10415/9444 https://etd.auburn.edu/bitstream/handle/10415/9444/Final_Thesis_AlArtatBinAli.pdf?sequence=2&isAllowed=y",,,2024
283,"Amstutz, E. S.","Drinking water security in the WUI: a comparative approach to understand drivers of adaptive drinking water systems in wildland-urban interface communities","… framework as it is applied in natural hazards literature to understand vulnerability to post-wildfire drinking water contamination in … a leading cause of community vulnerability. Causes of “…",,,,,,,,,,,"GS Search 2",,,"2024-10-03 23:12:34","2024-10-03 23:12:34",,,,,,,,,,,,,,,,,,,"Query date: 2024-09-27 10:24:01",,,,,,,,,,ir.library.oregonstate.edu,,,,,,"Drinking water security in the WUI: a comparative approach to understand drivers of adaptive drinking water systems in wildland-urban interface communities",,,,BOOK,,"https://ir.library.oregonstate.edu/concern/graduate_thesis_or_dissertations/hd76s7743 https://ir.library.oregonstate.edu/downloads/zw12zd67t",,,2023
284,"Arora, A., Sundaram, V., Zimmerman, L.","Community Vulnerability Index Dashboard","… community vulnerability dashboard. On the left sidebar 100, users can choose to display either the community vulnerability … heat map 102 of the community vulnerability index across a …",,,,,,,,,,,"GS Search 2",,//,"2024-10-03 23:12:34","2024-10-03 23:12:34",,,,,,,,,"US Patent App. 17 …",,,,,,,,,"Cited By (since 2021): 5",,,,,,,,,,,,,,,,,"Community Vulnerability Index Dashboard",,,,JOUR,,"https://patents.google.com/patent/US20210280320A1/en https://patentimages.storage.googleapis.com/29/75/81/483ac2831018ec/US20210280320A1.pdf",,,2021
285,"Bennett, Nathan James, Blythe, Jessica, Tyler, Stephen, Ban, Natalie C.","Communities and change in the anthropocene: understanding social-ecological vulnerability and planning adaptations to multiple interacting exposures","… framework and facilitate assessments and comparative analyses of community vulnerability, … , including anthropogenic climate change, pollution and degradation of water quality. …",,,,,,,,,,,"GS Search 2",,//,"2024-10-03 23:12:34","2024-10-03 23:12:34",,10.1007/s10113-015-0839-5,,,,,"1436-3798 1436-378X",4,"Regional Environmental Change",,,,,,,,,"Cited By (since 2016): 341",,,,,,,907-926,,,,,,,,,907,"Communities and change in the anthropocene: understanding social-ecological vulnerability and planning adaptations to multiple interacting exposures",,,,JOUR,,https://link.springer.com/article/10.1007/s10113-015-0839-5,,16,2015
