"Refid","Author","Title","Abstract","Accession Number","Art. no.","Article Number","Author Address","Author keywords","Author(s) id","Cited by","Comments","Custom 4","Custom 5","Database","Database Provider","Date","distiller_reference_created_date","distiller_reference_upload_date","Document type","DOI","Eid","Epub Date","File attachment","Index keywords","ISSN","Issue","Journal","Keywords","Label","Language","Legal Note","Level","Link","min_level","NIHMSID","Notes","Number","Open access","Original Publication","Page count","Page end","Page start","Pages","Place Published","PMCID","Publication stage","Publisher","Pubmed id","Rapidscreening","Research Notes","Secondary Author","Section","Short Title","Source","Source title","Translated Title","Type","Type of Work","URL","User","Volume","Year"
566,"Hernandez-Cortes, D., Meng, K. C.","Do environmental markets cause environmental injustice? Evidence from California's carbon market","… dispersal model to characterize resulting spatial changes in pollution concentrations, we find … -level changes in pollution concentrations. We develop a statistical framework that jointly …",,,,,,,,,,,"GS Search 7",,//,"2024-10-03 23:12:36","2024-10-03 23:12:36",,,,,,,,,"Journal of Public Economics",,,,,,,,,"Cited By (since 2023): 128",,,,,,,,,,,,,,,,,"Do environmental markets cause environmental injustice? Evidence from California's carbon market",,,,JOUR,,https://www.sciencedirect.com/science/article/pii/S0047272722001888,,,2023
567,"Ilyniak, N.","Mercury poisoning in grassy narrows: Environmental injustice, colonialism, and capitalist expansion in Canada","… Abstract: Using an environmental injustice framework, this … of environmental injustice– the distributional patterns of … targeting instances of pollution and environmental degradation, also …",,,,,,,,,,,"GS Search 7",,//,"2024-10-03 23:12:36","2024-10-03 23:12:36",,,,,,,,,"McGill Sociological Review",,,,,,,,,"Cited By (since 2014): 43",,,,,,,,,,,,,,,,,"Mercury poisoning in grassy narrows: Environmental injustice, colonialism, and capitalist expansion in Canada",,,,JOUR,,http://www.mcgill.ca/msr/files/msr/ilyniak_2014.pdf,,,2014
568,"Kanger, L., Sovacool, B. K.","Towards a multi-scalar and multi-horizon framework of energy injustice: A whole systems analysis of Estonian energy transition","… cluster (1) with a share of 18.7% focuses on environmental injustices. Direct harmful environmental … Another category of environmental threats is related to air and soil pollution, …",,,,,,,,,,,"GS Search 7",,//,"2024-10-03 23:12:36","2024-10-03 23:12:36",,,,,,,,,"Political Geography",,,,,,,,,"Cited By (since 2022): 25",,,,,,,,,,,,,,,,,"Towards a multi-scalar and multi-horizon framework of energy injustice: A whole systems analysis of Estonian energy transition",,,,JOUR,,https://www.sciencedirect.com/science/article/pii/S0962629821002043,,,2022
569,"Kelly-Reif, K., Wing, S.","Urban-rural exploitation: An underappreciated dimension of environmental injustice","… A basic step towards reducing rural environmental injustice is to develop the scientific framework needed to monitor pollutants and health outcomes in rural places through partnerships …",,,,,,,,,,,"GS Search 7",,//,"2024-10-03 23:12:36","2024-10-03 23:12:36",,,,,,,,,"Journal of Rural Studies",,,,,,,,,"Cited By (since 2016): 130",,,,,,,,,,,,,,,,,"Urban-rural exploitation: An underappreciated dimension of environmental injustice",,,,JOUR,,"https://www.sciencedirect.com/science/article/pii/S0743016716300420 https://greenresistance.wordpress.com/wp-content/uploads/2017/01/urban-rural-exploitation-an-underappreciated-dimension-of-environmental-injustice.pdf",,,2016
570,"Kubanza, Nzalalemba Serge, Simatele, Danny","Social and environmental injustices in solid waste management in sub-Saharan Africa: a study of Kinshasa, the Democratic Republic of Congo","… environmental injustice during this period tended to focus on issues relating to the management of toxic waste, solid waste and pollution … effective environmental management framework…",,,,,,,,,,,"GS Search 7",,//,"2024-10-03 23:12:36","2024-10-03 23:12:36",,10.1080/13549839.2015.1038985,,,,,"1354-9839 1469-6711",7,"Local Environment",,,,,,,,,"Cited By (since 2016): 74",,,,,,,866-882,,,,,,,,,866,"Social and environmental injustices in solid waste management in sub-Saharan Africa: a study of Kinshasa, the Democratic Republic of Congo",,,,JOUR,,https://www.tandfonline.com/doi/abs/10.1080/13549839.2015.1038985,,21,2015
571,"Lester, James P., Allen, David W., Hill, Kelly M.","Environmental Injustice in the United States","… exposing them to more toxic pollutants than is the case for white … by permitting industrial pollution in their neighborhoods at a … agenda, using the framework suggested by John Kingdon (…",,,,,,,,,,,"GS Search 7",,,"2024-10-03 23:12:36","2024-10-03 23:12:36",,10.4324/9780429500787,,,,,9780429500787,,,,,,,,,,,"Cited By (since 2018): 178","Query date: 2024-09-27 10:42:22",,,,,,,,,,taylorfrancis.com,,,,,,"Environmental Injustice in the United States",,,,BOOK,,https://www.taylorfrancis.com/books/mono/10.4324/9780429500787/environmental-injustice-james-lester,,,2018
572,"Liu, W., Shen, J., Wei, Y. D., Chen, W.","Environmental justice perspective on the distribution and determinants of polluting enterprises in Guangdong, China","… This paper proposes a heuristic analytical framework to … We propose two methods to address environmental injustice in … The second method is to reduce environmental pollution …",,,,,,,,,,,"GS Search 7",,//,"2024-10-03 23:12:36","2024-10-03 23:12:36",,,,,,,,,"Journal of Cleaner Production",,,,,,,,,"Cited By (since 2021): 19",,,,,,,,,,,,,,,,,"Environmental justice perspective on the distribution and determinants of polluting enterprises in Guangdong, China",,,,JOUR,,"https://www.sciencedirect.com/science/article/pii/S0959652621025488 https://drive.google.com/file/d/1VFQKjRn-8bcr8IcX8Z2s-JoJQfLYZO6m/view",,,2021
573,"Mah, Alice, Wang, Xinhong","Accumulated Injuries of Environmental Injustice: Living and Working with Petrochemical Pollution in Nanjing, China","This article examines perceptions of living and working with toxic pollution in two periurban petrochemical areas in Nanjing, China, a heavily polluted megacity on the Yangtze River. Despite the concentrated geography of the petrochemical industry in Nanjing, protests over pollution have been small scale and highly localized, paralleling dynamics in many “cancer villages” of rural China. This contrasts with high-profile anti-PX (paraxylene) protests that have happened in Xiamen, Dalian, and other cities in China over the past decade. This article draws on twenty-five semistructured interviews and participant observation with workers and residents in both petrochemical areas. We extend the idea of the “hidden injuries of class” (Sennett and Cobb 1972) to analyze the cumulative effects of social and environmental inequalities in China, contributing to interdisciplinary debates about environmental justice and health, environmental pollution in China, and the lived experiences of toxic geographies. We argue that people living and working with petrochemical pollution in Nanjing, China, experienced accumulated injuries of environmental injustice: multilayered and intersecting effects on health and well-being, which reflect social inequalities between different populations. Accumulated injuries of environmental injustice emerged in interrelated ways: epistemic injustices about toxic exposures; unequal and inadequate compensations for environment harm; and collective frustrations over political powerlessness. The research has wider implications for analyzing the complex social effects of living and working with environmental injustice in different places around the world. Key Words: China, environmental health, environmental justice, petrochemical industry, toxic pollution.",,,,,,,,,,,"GS Search 7",,//,"2024-10-03 23:12:36","2024-10-03 23:12:36",,10.1080/24694452.2019.1574551,,,,,"2469-4452 2469-4460",6,"Annals of the American Association of Geographers",,,,,,,,,"Cited By (since 2019): 55",,,,,,,1961-1977,,,,,,,,,1961,"Accumulated Injuries of Environmental Injustice: Living and Working with Petrochemical Pollution in Nanjing, China",,,,JOUR,,"https://www.tandfonline.com/doi/abs/10.1080/24694452.2019.1574551 https://www.tandfonline.com/doi/pdf/10.1080/24694452.2019.1574551",,109,2019
574,"Mascarenhas, M. J.","Where the waters divide: Neoliberal racism, white privilege and environmental injustice","… “You see we are ending up with pollution sources coming up all around us. It is still a struggle … This form of unequal exchange—pollution in one area and wealth generation for another—…",,,,,,,,,,,"GS Search 7",,//,"2024-10-03 23:12:36","2024-10-03 23:12:36",,,,,,,,,"Race, Gender &Class",,,,,,,,,"Cited By (since 2016): 26",,,,,,,,,,,,,,,,,"Where the waters divide: Neoliberal racism, white privilege and environmental injustice",,,,JOUR,,"https://www.jstor.org/stable/26529206 https://www.academia.edu/download/52394038/Macarenhas__Michael_J__rgc_233-4_pp._6-25.pdf",,,2016
575,"Milbourne, Paul, Mason, Kelvin","Environmental injustice and post-colonial environmentalism: Opencast coal mining, landscape and place","… injustice that emphasises competing geographical imaginaries of landscape … injustices’ within everyday spaces. We begin with a discussion of how historical environmental injustices in …",,,,,,,,,,,"GS Search 7",,//,"2024-10-03 23:12:36","2024-10-03 23:12:36",,10.1177/0308518x16665843,,,,,"0308-518X 1472-3409",1,"Environment and Planning A: Economy and Space",,,,,,,,,"Cited By (since 2017): 30",,,,,,,29-46,,,,,,,,,29,"Environmental injustice and post-colonial environmentalism: Opencast coal mining, landscape and place",,,,JOUR,,"https://journals.sagepub.com/doi/abs/10.1177/0308518X16665843 https://orca.cardiff.ac.uk/id/eprint/94102/3/P%20Milbourne%20(2016)%20Environmental%20injustice%20postprint.pdf",,49,2016
576,"Orta-Martínez, M., Pellegrini, L., Arsel, M.","“The squeaky wheel gets the grease”? The conflict imperative and the slow fight against environmental injustice in northern Peruvian Amazon","… We ourselves will stop pollution in our communities. We … environmental analysis conducted by different governmental agencies within the framework of the investigation of oil pollution …",,,,,,,,,,,"GS Search 7",,//,"2024-10-03 23:12:36","2024-10-03 23:12:36",,,,,,,,,"Ecology and Society",,,,,,,,,"Cited By (since 2018): 53",,,,,,,,,,,,,,,,,"“The squeaky wheel gets the grease”? The conflict imperative and the slow fight against environmental injustice in northern Peruvian Amazon",,,,JOUR,,"https://www.jstor.org/stable/26799131 https://www.researchgate.net/profile/Lorenzo-Pellegrini-2/publication/326470088_The_squeaky_wheel_gets_the_grease_The_conflict_imperative_and_the_slow_fight_against_environmental_injustice_in_northern_Peruvian_Amazon/links/5b61b06da6fdccf0b2059d47/The-squeaky-wheel-gets-the-grease-The-conflict-imperative-and-the-slow-fight-against-environmental-injustice-in-northern-Peruvian-Amazon.pdf",,,2018
577,"Owens, Katharine A., Conlon, Katie","Mopping Up or Turning Off the Tap? Environmental Injustice and the Ethics of Plastic Pollution","… an issue of slow violence (Homer-Dixon, 2000) and environmental injustice. While plastic pollution is universal, some consequences such as clogged drainage systems, increases in …",,,,,,,,,,,"GS Search 7",,//,"2024-10-03 23:12:36","2024-10-03 23:12:36",,10.3389/fmars.2021.713385,,,,,2296-7745,,"Frontiers in Marine Science",,,,,,,,,"Cited By (since 2021): 28",,,,,,,,,,,,,,,,,"Mopping Up or Turning Off the Tap? Environmental Injustice and the Ethics of Plastic Pollution",,,,JOUR,,https://www.frontiersin.org/articles/10.3389/fmars.2021.713385/full?ref=arts-help,,8,2021
578,"Parsons, Allison A., Besenyi, Gina M., Kaczynski, Andrew T., Wilhelm Stanis, Sonja A., Blake, Christine E., Barr-Anderson, Daheia J.","Investigating Issues of Environmental Injustice in Neighborhoods Surrounding Parks","… Using an environmental justice framework, this study in Kansas City, Missouri examined … These exposures to such things as pollution and hazardous waste have been shown to lead to …",,,,,,,,,,,"GS Search 7",,//,"2024-10-03 23:12:36","2024-10-03 23:12:36",,10.1080/00222216.2015.11950361,,,,,"0022-2216 2159-6417",2,"Journal of Leisure Research",,,,,,,,,"Cited By (since 2015): 38",,,,,,,285-303,,,,,,,,,285,"Investigating Issues of Environmental Injustice in Neighborhoods Surrounding Parks",,,,JOUR,,"https://www.tandfonline.com/doi/abs/10.1080/00222216.2015.11950361 https://www.researchgate.net/profile/Allison-Parsons-3/publication/279326874_Investigating_Issues_of_Environmental_Injustice_in_Neighborhoods_Surrounding_Parks/links/55f1a56a08aedecb690175d5/Investigating-Issues-of-Environmental-Injustice-in-Neighborhoods-Surrounding-Parks.pdf",,47,2017
579,"Pellow, D., Vazin, J.","The intersection of race, immigration status, and environmental justice","… other air contaminants, have significant water contamination, … into a broader “environmental” framework and to integrate … health threats constitute environmental injustices, and the …",,,,,,,,,,,"GS Search 7",,//,"2024-10-03 23:12:36","2024-10-03 23:12:36",,,,,,,,,Sustainability,,,,,,,,,"Cited By (since 2019): 39",,,,,,,,,,,,,,,,,"The intersection of race, immigration status, and environmental justice",,,,JOUR,,https://www.mdpi.com/2071-1050/11/14/3942,,,2019
580,"Vaz, E., Anthony, A., McHenry, M.","The geography of environmental injustice","… , (ii) the major pollution sources status of an area based on its … a spatially-explicit Environmental Injustice framework, using … volume of air-borne pollutants into the nearby air was carried …",,,,,,,,,,,"GS Search 7",,//,"2024-10-03 23:12:36","2024-10-03 23:12:36",,,,,,,,,"Habitat International",,,,,,,,,"Cited By (since 2017): 51",,,,,,,,,,,,,,,,,"The geography of environmental injustice",,,,JOUR,,https://www.sciencedirect.com/science/article/pii/S0197397516310591,,,2017
581,"York, Abigail, Tuccillo, Joseph, Boone, Christopher, Bolin, Bob, Gentile, Lauren, Schoon, Briar, Kane, Kevin","Zoning and Land Use: A Tale of Incompatibility and Environmental Injustice in Early Phoenix","… land use siting, factory pollution, congestion, overcrowding, … most historically prevalent zoning framework—permitted the … the Euclidean zoning framework treated residential density—…",,,,,,,,,,,"GS Search 7",,//,"2024-10-03 23:12:36","2024-10-03 23:12:36",,10.1111/juaf.12076,,,,,"0735-2166 1467-9906",5,"Journal of Urban Affairs",,,,,,,,,"Cited By (since 2014): 38",,,,,,,833-853,,,,,,,,,833,"Zoning and Land Use: A Tale of Incompatibility and Environmental Injustice in Early Phoenix",,,,JOUR,,"https://www.tandfonline.com/doi/abs/10.1111/juaf.12076 https://www.academia.edu/download/98197555/juaf.1207620230203-1-1yxi50l.pdf",,36,2016
582,"Zhai, T., Wang, J., Jin, Z., Qi, Y., Fang, Y., Liu, J.","Did improvements of ecosystem services supply-demand imbalance change environmental spatial injustices?","… ESSDI also caused serious environmental injustice as a result … GDP, the degree of environmental pollution showed a declining … The framework of the national ecological …",,,,,,,,,,,"GS Search 7",,//,"2024-10-03 23:12:36","2024-10-03 23:12:36",,,,,,,,,"Ecological indicators",,,,,,,,,"Cited By (since 2020): 96",,,,,,,,,,,,,,,,,"Did improvements of ecosystem services supply-demand imbalance change environmental spatial injustices?",,,,JOUR,,https://www.sciencedirect.com/science/article/pii/S1470160X20300054,,,2020
583,"Zhai, T., Zhang, D., Zhao, C.","How to optimize ecological compensation to alleviate environmental injustice in different cities in the Yellow River Basin? A case of integrating ecosystem service …","… environmental injustice. Implementation of ecological compensation (EC) can internalize the external effects and effectively solve environmental … externalities and environmental justice …",,,,,,,,,,,"GS Search 7",,//,"2024-10-03 23:12:36","2024-10-03 23:12:36",,,,,,,,,"Sustainable Cities and Society",,,,,,,,,"Cited By (since 2021): 93",,,,,,,,,,,,,,,,,"How to optimize ecological compensation to alleviate environmental injustice in different cities in the Yellow River Basin? A case of integrating ecosystem service …",,,,JOUR,,https://www.sciencedirect.com/science/article/pii/S221067072100617X,,,2021
584,"…, Resilience, Committee on Measuring Community","Building and measuring community resilience: actions for communities and the Gulf Research Program","… This report lays out a framework for any community to take on its community resilience and monitor its progress; it also offers a specific approach for the GRP to do the same. …",,,,,,,,,,,"GS Search 8",,,"2024-10-03 23:12:36","2024-10-03 23:12:36",,,,,,,,,,,,,,,,,,"Cited By (since 2019): 81","Query date: 2024-09-27 12:09:19",,,,,,,,,,books.google.com,,,,,,"Building and measuring community resilience: actions for communities and the Gulf Research Program",,,,BOOK,,https://books.google.com/books?hl=en&lr=&id=8ROXDwAAQBAJ&oi=fnd&pg=PR1&dq=%22community+resilience%22+%22conceptual+model%22+pollution%7Cpolluted%7Cpollutants%7Ccontamination%7Ccontaminated%7Ccontaminants%7Ccontaminates&ots=sBMMx6D8jN&sig=LT6Vhz5jlLKJhByANa_zjKrt7R0,,,2019
585,"Akbar, Z.","Community Resilience: Lesson Learnt from Disaster Survivors in Yogyakarta Province Indonesia","… This research found the conceptual model of community resilience in post-disaster … when a disaster occurs are an outbreak of disease, contamination of water / lack of water and food …",,,,,,,,,,,"GS Search 8",,//,"2024-10-03 23:12:36","2024-10-03 23:12:36",,10.1088/1755-1315/273/1/012036,,,,,"1755-1307 1755-1315",1,"IOP Conference Series: Earth and Environmental Science",,,,,,,,,"Cited By (since 2019): 7",,,,,,,,,,,,,,,,012036,"Community Resilience: Lesson Learnt from Disaster Survivors in Yogyakarta Province Indonesia",,,,JOUR,,"https://iopscience.iop.org/article/10.1088/1755-1315/273/1/012036/meta https://iopscience.iop.org/article/10.1088/1755-1315/273/1/012036/pdf",,273,2019
586,"Allen, Thomas R., Crawford, Thomas, Montz, Burrell, Whitehead, Jessica, Lovelace, Susan, Hanks, Armon D., Christensen, Ariel R., Kearney, Gregory D.","Linking Water Infrastructure, Public Health, and Sea Level Rise: Integrated Assessment of Flood Resilience in Coastal Cities","… to the water contamination crisis of Flint, Michigan. … are represented in the conceptual model to produce variable … exacerbate many aspects of community resilience. Extreme rainfall can …",,,,,,,,,,,"GS Search 8",,//,"2024-10-03 23:12:36","2024-10-03 23:12:36",,10.1177/1087724x18798380,,,,,"1087-724X 1552-7549",1,"Public Works Management & Policy",,,,,,,,,"Cited By (since 2019): 85",,,,,,,110-139,,,,,,,,,110,"Linking Water Infrastructure, Public Health, and Sea Level Rise: Integrated Assessment of Flood Resilience in Coastal Cities",,,,JOUR,,"https://journals.sagepub.com/doi/abs/10.1177/1087724X18798380 https://journals.sagepub.com/doi/pdf/10.1177/1087724X18798380",,24,2018
587,"Andrews, E. J., Staples, K., Reed, M. G., Carriere, R.","Insights for building community resilience from prioritizing youth in environmental change research","… We used Reimer et al.’s [45] conceptual model to assess youth engagement interventions … For example, concern over water levels and pollution and the need for respect for nature …",,,,,,,,,,,"GS Search 8",,//,"2024-10-03 23:12:36","2024-10-03 23:12:36",,,,,,,,,Sustainability,,,,,,,,,"Cited By (since 2019): 5",,,,,,,,,,,,,,,,,"Insights for building community resilience from prioritizing youth in environmental change research",,,,JOUR,,https://www.mdpi.com/2071-1050/11/18/4916,,,2019
588,"Angeler, David G.","Conceptualizing resilience in temporary wetlands","… A conceptual model of resilience of temporary wetlands is … and lead to accidental contamination and eutrophication of … assess the generality of contamination severity and ecological …",,,,,,,,,,,"GS Search 8",,//,"2024-10-03 23:12:36","2024-10-03 23:12:36",,10.1080/20442041.2021.1893099,,,,,"2044-2041 2044-205X",4,"Inland Waters",,,,,,,,,"Cited By (since 2021): 7",,,,,,,467-475,,,,,,,,,467,"Conceptualizing resilience in temporary wetlands",,,,JOUR,,"https://www.tandfonline.com/doi/abs/10.1080/20442041.2021.1893099 https://www.tandfonline.com/doi/pdf/10.1080/20442041.2021.1893099",,11,2021
589,"Awah, Lum Sonita, Nyam, Yong Sebastian, Belle, Johanes Amate, Orimoloye, Israel Ropo","Understanding drivers of changing flood dynamics for enhancing coastal community resilience: a participatory approach","… The study findings emphasized four key priority areas to enhance policy and community resilience: restoring natural buffer zones like wetlands, increasing local involvement in flood risk …",,,,,,,,,,,"GS Search 8",,//,"2024-10-03 23:12:36","2024-10-03 23:12:36",,10.1007/s10113-024-02276-7,,,,,"1436-3798 1436-378X",4,"Regional Environmental Change",,,,,,,,,,,,,,,,,,,,,,,,,,"Understanding drivers of changing flood dynamics for enhancing coastal community resilience: a participatory approach",,,,JOUR,,https://link.springer.com/article/10.1007/s10113-024-02276-7,,24,2024
590,"Beauchemin, M. H.","Developing a conceptual framework to assess the social-ecological resilience of the Canadian agroecosystem","… The production of agricultural inputs contributes to environmental pollution, one of the major drivers of global environmental changes. These environmental changes are increasing the …",,,,,,,,,,,"GS Search 8",,,"2024-10-03 23:12:36","2024-10-03 23:12:36",,,,,,,,,,,,,,,,,,,"Query date: 2024-09-27 12:09:19",,,,,,,,,,search.proquest.com,,,,,,"Developing a conceptual framework to assess the social-ecological resilience of the Canadian agroecosystem",,,,BOOK,,https://search.proquest.com/openview/bb1f1bacb3a51f0b70e7efde9ac6c33e/1?pq-origsite=gscholar&cbl=18750&diss=y,,,2022
591,"Blair, B., Lovecraft, A. L., Kofinas, G. P.","Meeting institutional criteria for social resilience: a nested risk system model","… risks such as potential contamination of the environment, … links that may exist with community resilience. The case studies … Our conceptual model envisions nested systems of risk …",,,,,,,,,,,"GS Search 8",,//,"2024-10-03 23:12:36","2024-10-03 23:12:36",,,,,,,,,"Ecology and Society",,,,,,,,,"Cited By (since 2014): 20",,,,,,,,,,,,,,,,,"Meeting institutional criteria for social resilience: a nested risk system model",,,,JOUR,,"https://www.jstor.org/stable/26269677 https://dlc.dlib.indiana.edu/dlc/bitstream/handle/10535/9641/ES-2014-6944.pdf?sequence=1",,,2014
592,"Brown, D.","Moving from risk to resilience: A proposal for holistic transformation of source water risk assessment","… toward the multi-barrier approach as a conceptual model that … have control over contamination sources that could affect the … that one should analyze sources of water contaminants, the …",,,,,,,,,,,"GS Search 8",,//,"2024-10-03 23:12:36","2024-10-03 23:12:36",,,,,,,,,,,,,,,,,,,,,,,,,,,,,,,,,,,"Moving from risk to resilience: A proposal for holistic transformation of source water risk assessment",,,,JOUR,,https://atrium.lib.uoguelph.ca/bitstream/10214/27607/5/Brown_Dustin_202305_MASc.pdf,,,2023
593,"Caputo, Silvio, Caserio, Maria, Coles, Richard, Jankovic, Ljubomir, Gaterell, Mark R.","Urban resilience: two diverging interpretations","… same word in ecology studies offers a conceptual model that has very different implications. … with buildings has a substantial impact on air pollution and climatic changes. This can also …",,,,,,,,,,,"GS Search 8",,//,"2024-10-03 23:12:36","2024-10-03 23:12:36",,10.1080/17549175.2014.990913,,,,,"1754-9175 1754-9183",3,"Journal of Urbanism: International Research on Placemaking and Urban Sustainability",,,,,,,,,"Cited By (since 2015): 44",,,,,,,222-240,,,,,,,,,222,"Urban resilience: two diverging interpretations",,,,JOUR,,"https://www.tandfonline.com/doi/abs/10.1080/17549175.2014.990913 https://researchportal.port.ac.uk/files/2211900/Urban_Resilience_two_diverging_interpretations.pdf",,8,2015
594,"Carrera, J. S., Key, K., Bailey, S., Hamm, J. A., Cuthbertson, C. A.","Community science as a pathway for resilience in response to a public health crisis in Flint, Michigan","… of lead and other contaminants in their water supply. The contaminants resulted from a series … has dovetailed with contributing to community resilience in that residents have been active …",,,,,,,,,,,"GS Search 8",,//,"2024-10-03 23:12:36","2024-10-03 23:12:36",,,,,,,,,"Social Sciences",,,,,,,,,"Cited By (since 2019): 45",,,,,,,,,,,,,,,,,"Community science as a pathway for resilience in response to a public health crisis in Flint, Michigan",,,,JOUR,,https://www.mdpi.com/2076-0760/8/3/94,,,2019
595,"Carroll, Ammm","COUNTY BROWNFIELDS: AN INTEGRATIVE REVIEW AND ANALYSIS OF CLEANUP REQUIRED AND REUSE CHOICE","… central to brownfield practice contaminated, disaster and vacant … and Payne-Sturges conceptual model of individual and community … structural racism and build community resilience. …",,,,,,,,,,,"GS Search 8",,,"2024-10-03 23:12:36","2024-10-03 23:12:36",,,,,,,,,,,,,,,,,,,"Query date: 2024-09-27 12:09:19",,,,,,,,,,jscholarship.library.jhu.edu,,,,,,"COUNTY BROWNFIELDS: AN INTEGRATIVE REVIEW AND ANALYSIS OF CLEANUP REQUIRED AND REUSE CHOICE",,,,BOOK,,"https://jscholarship.library.jhu.edu/items/b1554ec3-8316-41ed-9c3a-280abc4fc659 https://jscholarship.library.jhu.edu/bitstreams/8bd14cbc-74f4-4b24-a127-e19001a84882/download",,,2018
